index,response
1,Solving complex mathematical equations in a research setting.
2,Analyzing market trends to make profitable investments.
3,Developing and designing algorithms to improve computer systems.
4,Researching and analyzing medical conditions to develop treatments.
5,Writing and publishing academic papers on various topics.
6,Creating and implementing educational curriculum plans.
7,Developing and launching new products in the technology industry.
8,Analyzing and interpreting data for market research and consumer behavior studies.
9,Creating and implementing government policies based on research and analysis.
10,Developing strategies for corporate mergers and acquisitions.
11,Working as an information security analyst.
12,Conducting scientific experiments and research.
13,Collaborating with other scientists to develop new technologies.
14,Conducting complex financial analysis for banking institutions.
15,Developing and implementing diagnostic and treatment plans for patients as a doctor.
16,Consulting with law enforcement agencies to solve complex cases.
17,Designing and developing software applications and systems.
18,Developing and implementing innovative manufacturing processes.
19,Developing new agricultural technologies to increase crop yields.
20,Conducting research on climate change and environmental issues to develop solutions.
21,Designing and developing energy efficient buildings and infrastructure.
22,Developing and implementing marketing strategies for businesses.
23,Analyzing and interpreting data for social science research studies.
24,Solving complex engineering problems in a variety of industries.
25,Conducting economic research to inform public policy decisions.
26,Developing and testing new pharmaceutical drugs.
27,Designing and implementing new transportation systems and infrastructure.
28,Developing new technologies for the military and defense industry.
29,Developing and implementing public health policies.
30,"Working as a professional athlete or coach, utilizing strategic intelligence."
31,Conducting research on social dynamics and cultural trends.
32,Developing new biotechnologies to improve human health and well-being.
33,Creating and implementing educational programs for children with special needs.
34,Developing new energy sources and technologies.
35,Evaluating and advising on educational programs and policies.
36,Developing new materials for manufacturing and construction.
37,Conducting research on the history of civilizations and cultures.
38,Developing and implementing sustainable business practices.
39,Designing and developing consumer products with unique features.
40,Conducting research on biodiversity to protect and preserve wildlife.
41,Developing new materials for spacecrafts and other aerospace technologies.
42,Conducting research on healthcare systems to improve efficiency and effectiveness.
43,Designing and implementing new technological advancements in the automotive industry.
44,Conducting research on alternative sources of fuel and energy.
45,Developing innovative programs for addiction treatment and recovery.
46,Developing and implementing financial strategies for businesses and individuals.
47,Designing and developing new materials for the fashion industry.
48,Conducting research on the history and effects of different types of art.
49,Developing new technologies for the entertainment industry.
50,Performing statistical analysis for medical studies and research.
51,Designing and implementing innovative urban planning initiatives.
52,Conducting research on the impacts of technology on human society.
53,Developing new materials for sports equipment.
54,Developing and implementing educational programs for adult learners.
55,Conducting research on the impact of climate change on ecosystems.
56,Designing and developing new materials for renewable energy systems.
57,Developing and implementing innovative legal strategies.
58,Conducting research on the neuroscience of the human brain.
59,Developing new technologies for space exploration.
60,Designing and developing new materials for medical implants and prosthetics.
61,Developing and implementing innovative solutions to global food crises.
62,Conducting research on wildlife behavior and migration patterns.
63,Designing and developing new materials for the construction of skyscrapers.
64,Developing innovative programs for promoting mental health and wellness.
65,Conducting research on the impacts of different types of media on society.
66,Developing new technologies for underwater exploration and discovery.
67,Designing and developing new materials for robotics and artificial intelligence.
68,Developing and implementing energy efficient lighting and electrical systems.
69,Conducting research on the psychological effects of different types of music.
70,Developing innovative programs for reducing poverty and economic inequality.
71,Developing new technologies for remote sensing and monitoring.
72,Designing and developing new materials for the construction of bridges and highways.
73,Developing and implementing innovative healthcare programs.
74,Conducting research on the impact of globalization on different cultures.
75,Developing new technologies for deep sea exploration and discovery.
76,Designing and developing new materials for renewable energy storage.
77,Developing innovative political strategies for promoting social justice.
78,Conducting research on the effects of different types of diets on health.
79,Developing new technologies for mining and resource extraction.
80,Designing and developing new materials for the construction of airports and seaports.
81,Developing and implementing innovative environmental policies and practices.
82,Conducting research on the social and psychological impacts of climate change.
83,Developing new technologies for artificial intelligence and machine learning.
84,Designing and developing new materials for the construction of public transportation systems.
85,Developing innovative educational programs for promoting cultural diversity and awareness.
86,Conducting research on the effects of different types of exercise on health.
87,Developing new technologies for smart home systems and automation.
88,Designing and developing new materials for the construction of high speed trains.
89,Developing and implementing innovative programs for promoting gender equality.
90,Conducting research on the cultural impacts of globalization.
91,Developing new technologies for the detection and prevention of cyber crime.
92,Designing and developing new materials for the construction of eco-friendly homes and buildings.
93,Developing innovative programs for promoting wellness and longevity.
94,Conducting research on the effects of different types of communication technologies on society.
95,Developing new technologies for autonomous vehicles and transportation systems.
96,Designing and developing new materials for the construction of renewable energy systems.
97,Developing and implementing innovative programs for promoting human rights.
98,Conducting research on the effects of different types of urban design on community health.
99,Developing new technologies for disaster relief and response.
100,Designing and developing new materials for the construction of sustainable infrastructure.
