index,response
1,Getting stuck in a traffic jam when running late for an important meeting
2,Losing your phone when you need it the most
3,Forgetting your password after multiple attempts
4,Accidentally deleting an important file
5,Waiting for a delayed flight with no explanation
6,Being put on hold for hours when calling customer service
7,Running out of gas on a long road trip with no gas station in sight
8,Being unable to find your keys when you're already running late
9,Losing your luggage during a flight
10,Having your credit card declined when trying to make a purchase
11,Getting lost in an unfamiliar city with no internet or GPS
12,Having a slow internet connection in the middle of an important task
13,Being stuck in a long line at the grocery store when you're in a hurry
14,Losing power during a storm and having no backup generator
15,Forgetting to save a document before the computer crashes
16,"Trying to get through to a doctor's office, but constantly getting a busy signal"
17,Getting a flat tire on the way to an important event
18,Having a power outage just as you're about to finish an important project
19,Running out of printer ink in the middle of printing a crucial document
20,Being unable to find a parking spot in a crowded lot
21,Being stuck on hold when trying to make a reservation for a special event
22,Having to deal with a difficult client who doesn't listen to reason
23,Breaking an important item that cannot be replaced
24,Not being able to find your glasses when you need them
25,Running out of hot water in the middle of a shower
26,Getting a speeding ticket when you're already running late
27,Having to redo an entire project because of a simple mistake
28,Waiting for a repair technician to arrive during a vague time frame
29,Getting stuck in an elevator with no phone signal
30,Losing an important document due to a computer virus
31,Being stuck in a crowded subway during rush hour
32,Forgetting a deadline and realizing it too late
33,Accidentally leaving your laptop on a plane
34,Being bitten by a mosquito while sleeping
35,Being put on hold when trying to cancel an unneeded subscription
36,Not being able to find a public restroom when you really need one
37,Forgetting an important appointment and having to reschedule
38,Getting a bad haircut that cannot be fixed
39,Waking up late and realizing you've missed a morning meeting
40,Losing your wallet with all your cash and credit cards
41,Being stuck in the rain without an umbrella
42,Going on a first date but having nothing to talk about
43,Being unable to attend a long-awaited event due to sickness
44,Accidentally sending an email to the wrong recipient
45,Being unable to sleep due to noise disturbance
46,Having to move after settling into a comfortable home
47,Having to sit through a lengthy and boring presentation
48,Having to cancel a long-awaited vacation due to unforeseen circumstances
49,Not being able to find your favorite book in the library
50,Being cancelled on last minute by a friend or colleague
51,Realizing that you've run out of a staple item when cooking dinner
52,Losing your umbrella during a rainy day
53,Getting lost in a large party or event
54,Having to take a difficult exam without being able to prepare for it
55,Having an unexpected allergic reaction to food
56,Forgetting to pack an essential item on a trip
57,Hosting an event and having guests cancel last minute
58,Being stuck in a long line to get tickets for an event
59,Spending hours working on a project only to have it rejected
60,Losing an important document within your home
61,Getting a massive parking ticket while parked legally
62,Being unable to access a website due to technical issues
63,Having to deal with a rude salesperson at a store
64,Being stuck in a slow-moving pedestrian line
65,"Forgetting an important date, such as an anniversary or birthday"
66,Having to cancel plans due to a family emergency
67,Getting stuck in a never-ending meeting
68,Having to pay for expensive repairs on your vehicle
69,Realizing that you've missed the season finale of your favorite show
70,Being unable to sleep due to noisy neighbors
71,Having a flight delayed or cancelled due to inclement weather
72,Finding out that your credit card has been compromised
73,Losing an object of sentimental value
74,Having to deal with a difficult boss or supervisor
75,Having to sit through a long and boring lecture
76,Having to move to a new city or state due to work or family
77,Having to deal with unreliable internet or phone service
78,Having to deal with a disrespectful coworker or classmate
79,Being unable to attend an important event due to distance or traffic
80,Being stuck in an overcrowded bus or train
81,Running out of time to complete an important task
82,Losing power and internet during a storm
83,"Being unable to find an item at the store, even after searching extensively"
84,Having to send back a dish at a restaurant due to poor quality
85,Having to pay for an expensive appliance repair
86,Realizing that you've been given incorrect directions while driving
87,Being stuck in a long and tedious line at the DMV
88,Having to take care of a sick family member or pet
89,Finding a parking spot far from your desired location
90,Running out of power on a camping trip or hike
91,Being stuck in a long and arduous interview process
92,Accidentally setting off an alarm in a public space
93,Losing a pet without any leads or sightings
94,Being stuck in an overly hot or cold environment
95,Being unable to find a suitable date or partner
96,Being stuck in a relationship that no longer suits you
97,Being stuck in a dead-end job with low pay and limited career prospects
98,Being unable to find a babysitter when you really need one
99,Losing a game or competition by just a few points or seconds
100,Having to deal with a car accident on a busy road or highway.
