index,response
1,"During a philosophy class, a debate on the ethics of genetic engineering sparks an open discussion among students and the professor."
2,"A group of coworkers share their thoughts on the company's new advertising campaign, including their criticisms and suggestions for improvement."
3,"In an art gallery, visitors explore a controversial exhibit and engage in impassioned conversations about artistic expression and social commentary."
4,"After a political rally, a diverse group of attendees from different parties and ideologies gather for a post-event discussion on current issues and solutions."
5,"In a community center, a parent-teacher association meeting turns into a heated debate about the effectiveness of standardized testing."
6,"A book club gathers to discuss a controversial novel on social justice, sharing their own personal experiences and perspectives on the theme."
7,"After a lecture on climate change, a group of concerned citizens engage in a dialogue on ways to mitigate the effects of global warming."
8,"At a town hall meeting, citizens discuss a proposed city ordinance on marijuana legalization, sharing their opinions and concerns."
9,"During a family dinner, relatives argue about immigration policies and its impact on communities around the world."
10,"In a coffee shop, a group of poets and writers engage in a lively debate on the role of literature in contemporary society."
11,"At a town festival, vendors and visitors exchange perspectives on cultural diversity and cross-cultural communication."
12,"In a religious gathering, members discuss their interpretation of sacred texts and their relevance in modern times."
13,"During a scientific conference, researchers share their findings on emerging technologies and engage in a dialogue on their ethical implications."
14,"A group of activists gather in front of a government building, protesting against a proposed law that they believe is unjust."
15,"At a music festival, performers and fans discuss the political and social messages conveyed through popular music."
16,"In a hospital, healthcare professionals discuss patient care policies and their impact on the quality of service provided."
17,A panel of experts convene to discuss the future of artificial intelligence and its potential impact on human society.
18,"At a student organization meeting, members share their ideas on ways to promote diversity and inclusivity on campus."
19,"In a science museum, visitors discuss the latest discoveries in space exploration and their potential for future innovation."
20,"During a TED Talk event, speakers and audience members engage in a discussion on cutting-edge ideas and solutions for global problems."
21,"At a culinary festival, chefs and food enthusiasts share their perspectives on the cultural significance of diverse cuisine."
22,"In a community forum, residents discuss and debate different approaches to improving neighborhood safety."
23,"After a screening of a documentary on social injustice, viewers share their emotions and opinions on the issue at hand."
24,"During a town council meeting, citizens voice their concerns and proposals for local policies and regulations."
25,"In a fitness center, gym-goers share their thoughts and experiences on body positivity and self-confidence."
26,"During a sports event, fans from both teams discuss their shared love for the game and their differences in opinion on strategies and players."
27,"At a gaming convention, industry experts and enthusiasts discuss the latest trends and developments in video games."
28,"In a fashion shop, customers and designers share their opinions on fashion sustainability and ethical practices."
29,"During a job interview, candidates engage in a discussion about their skills and future aspirations."
30,"At a music concert, fans discuss the historical and cultural significance of the music genre and how it has evolved over time."
31,"In a park, neighbors gather for a friendly debate on the best way to maintain public spaces."
32,"During a business conference, entrepreneurs share their experiences and advice on the startup culture."
33,"At a cooking class, attendees discuss the cultural origins and significance of the dishes they are learning to prepare."
34,"In a recreational vehicle park, travelers share their stories and travel tips from their journeys across the country."
35,"During an academic conference, scholars present their research findings and engage in a debate on the theoretical significance of their work."
36,"At a theater performance, audience members discuss the social commentary and artistic interpretation behind the play."
37,"In a technology convention, developers share their visions for the future of technology and its impact on society."
38,"During a parent-teacher conference, parents share their concerns and suggestions for their child's academic growth."
39,"At a protest rally, participants engage in a peaceful dialogue on the social injustice issues they are fighting for."
40,"In a museum excursion, visitors discuss the historical and cultural significance of the artifacts on display."
41,"During a legal meeting, attorneys discuss different approaches to resolving client disputes."
42,"At a film festival, filmmakers and critics engage in a lively discussion on the cinematic trends and their artistic significance."
43,"In a nature retreat, nature enthusiasts discuss the importance of eco-tourism and environmental conservation."
44,"During a city council meeting, members discuss different approaches to improving the economic growth and stability of the community."
45,"In a language school, students share their experiences and improvements in acquiring new languages."
46,"At a woodworking class, novice woodworkers share their projects and learn new techniques from experienced craftsmen."
47,"During an animal welfare charity event, animal lovers and activists discuss the ethical treatment of animals and ways to support their welfare."
48,"In a book fair, authors and literary reviewers share their thoughts on contemporary literature and its relevance to society."
49,"At a family gathering, relatives discuss parenting challenges and share their advice on child-rearing."
50,"During a career fair, job seekers learn more about career opportunities and engage in a dialogue on the current job market."
51,"In a travel group, travelers share their cultural experiences and learn more about different lifestyles and customs."
52,"At a fashion show, fashion designers and models discuss the cultural and artistic influence behind their creations."
53,"During a political campaign event, candidates share their vision for the future and engage in a dialogue on important issues."
54,"In a language exchange program, participants discuss the cultural nuances and differences they encounter when communicating in a foreign language."
55,"At an innovation summit, entrepreneurs and investors discuss new technological solutions and their impact on society."
56,"During a community service event, volunteers share their experiences and the impact of their efforts in helping the community."
57,"In a photography class, students share their artistic perspectives and critique their peers' work."
58,"At an environmental protection seminar, experts discuss ways to preserve natural resources and protect the environment."
59,"During a job performance review, supervisors and employees discuss work expectations, progress, and goals."
60,"In a barbershop, clients share their experiences and conversations on different social and cultural topics."
61,"At a startup incubator event, entrepreneurs share their business ideas and receive feedback and guidance from investors and mentors."
62,"During a religious pilgrimage, participants reflect on their faith and engage in discussions about spirituality and morality."
63,"In a gender equality forum, women and men discuss ways to promote gender equality and women empowerment."
64,"At a nutritional seminar, experts discuss the health benefits of different foods and diet plans."
65,"During a charity event, volunteers and organizers discuss the mission and impact of the organization in helping the community."
66,"In an art workshop, participants discuss the artistic value and meaning behind their creations."
67,"At a construction site, workers share their experiences and challenges in building and developing infrastructure."
68,"During a political talk show, guests engage in a debate on current political issues and share their various perspectives."
69,"In a dance class, participants learn about different dance styles and cultures and share their personal experiences."
70,"At a cultural festival, participants share their love for and appreciation of art, music, and literature."
71,"During a mindfulness workshop, participants discuss ways to improve their mental and emotional well-being."
72,"In an assisted living facility, seniors share their life experiences and lessons with each other."
73,"At a criminal justice forum, lawyers, judges, and activists discuss ways to improve the justice system and reduce recidivism."
74,"During a university panel discussion, students and professors exchange their academic research and scholarly viewpoints."
75,"In a counseling session, clients discuss their psychological and emotional issues and receive therapeutic guidance."
76,"At a religious retreat, participants engage in spiritual and reflective discussions with each other."
77,"During a health and wellness seminar, attendees learn about their physical and mental health and discuss different approaches to staying healthy."
78,"In a social media marketing conference, marketers share their strategies and insights on the growing digital platform."
79,"At a sports training camp, coaches and athletes discuss different training strategies and physical regimens."
80,"During a charity auction, bidders engage in a friendly competition to support their favored cause."
81,"In an immigration reform forum, stakeholders discuss ways to address the challenges and opportunities of immigration reform."
82,"At a cooking competition, contestants share their culinary skills and creativity."
83,"During a fashion design competition, designers present their fashion lines and receive critiques and feedback."
84,"In a community service awards ceremony, volunteers are recognized and celebrated for their contributions to the community."
85,"In a technology hackathon, participants develop and present innovative technological solutions to societal challenges."
86,"At an academic debate, students and professors engage in a formal, structured discussion on academic hypotheses."
87,"During a music composition competition, composers share their creative works and receive feedback and guidance."
88,"In a language translation service, professionals discuss the technical and cultural nuances of multilingual communication."
89,"In a creative writing workshop, aspiring writers discuss the art and craft of writing and share their writing works."
90,"At a film production workshop, filmmakers discuss the mechanics and aesthetics of cinematography."
91,"During a scientific research symposium, researchers share their scientific findings and engage in a scholarly debate."
92,"In a sustainable design exhibit, designers showcase their environmentally conscious designs and engage in a dialogue on sustainability."
93,"At a gaming hackathon, participants create and develop innovative technological solutions for gaming and esports."
94,"In a podcasting conference, podcasters share their insights and techniques on creating and developing successful podcast content."
95,"During a legal mediation session, litigators participate in a confidential and neutral negotiation to resolve disputes."
96,"In a graphic design workshop, designers share their design approaches and techniques and critique their peers' work."
97,"At a product design competition, designers present their ideas and creative works, competing for the top spot."
98,"During a scientific lecture, scientists present and discuss scientific hypotheses and theories."
99,"In a social entrepreneurship forum, entrepreneurs discuss ways to incorporate social responsibility into business ventures."
100,"At a music production competition, producers showcase their music production skills and techniques."
