index,response
1,A child is being bullied at school and fears for their safety.
2,A woman receives threatening messages from a former partner.
3,A man is in a toxic work environment with a boss who constantly belittles him.
4,A family member is diagnosed with a life-threatening illness.
5,A teenager is struggling with depression and thoughts of self-harm.
6,A new employee is constantly being undermined by a jealous co-worker.
7,A parent is concerned about their child's drug use.
8,A person is the victim of cyberbullying on social media.
9,A survivor of sexual assault must face their attacker in court.
10,A person is in an abusive relationship and fears for their safety if they leave.
11,A family is struggling to cope with the unexpected death of a loved one.
12,A person is dealing with a chronic health condition that has no cure.
13,A student is being targeted and bullied by peers on campus.
14,A person is dealing with the loss of a job and financial instability.
15,A person is experiencing anxiety and panic attacks.
16,"A child is being neglected by their parent, who struggles with addiction."
17,A person is a victim of racism and discrimination in their workplace.
18,A person is dealing with the emotional fallout of a traumatic event.
19,A parent is worried about their child's safety while away at college.
20,A person is struggling with addiction and facing the possibility of losing their job.
21,A person is experiencing domestic violence and is afraid to leave their abuser.
22,A person is dealing with the loss of a pet who was like family.
23,A person is struggling with social anxiety and is afraid to attend social events.
24,A person is facing a serious illness and the uncertainty of their future.
25,A victim of identity theft is dealing with the emotional aftermath of the crime.
26,A person is experiencing PTSD after a traumatic experience.
27,A person is dealing with the effects of verbal abuse from a family member.
28,A person is struggling to come out to their family due to fear of rejection.
29,A person is dealing with the aftermath of a car accident.
30,A person is being stalked by an ex-partner.
31,A person is dealing with the emotional fallout of a divorce.
32,A person is being harassed at work by a superior.
33,A person is the victim of a hate crime and fears for their safety.
34,A person is dealing with the loss of a close friend.
35,A person is dealing with the emotional fallout of a miscarriage.
36,A person is struggling with body image issues and eating disorders.
37,A person is the victim of bullying in a nursing home.
38,A person is dealing with the loss of their home due to a natural disaster.
39,A person is struggling with the emotional effects of a parent's alcoholism.
40,A person is experiencing the emotional fallout of a car accident that injured loved ones.
41,A person is feeling pressured to conform to societal beauty standards.
42,A person is dealing with the emotional fallout of a robbery.
43,A person is being harassed by a neighbor who is suffering from mental health issues.
44,A person is dealing with the emotional effects of a previous relationship.
45,A person is struggling with depression and suicidal thoughts.
46,A person is dealing with the emotional fallout of a workplace accident.
47,A person is dealing with the effects of a traumatic brain injury.
48,A person is struggling with the emotional effects of a history of abuse.
49,A person is dealing with the emotional damage caused by a toxic friendship.
50,A person is the victim of emotional abuse from a parent or family member.
51,A person is struggling with the emotional fallout of having a family member incarcerated.
52,A person is feeling overwhelmed and unsure of their future career path.
53,A person is feeling insecure in their romantic relationship.
54,A person is dealing with the aftermath of a natural disaster that destroyed their home.
55,A person is struggling with the emotional effects of a past miscarriage.
56,A person is dealing with the emotional fallout of being laid off from a job.
57,A person is struggling with the emotional effects of living with a chronic illness.
58,A person is dealing with the emotional damage caused by a traumatic childhood experience.
59,A person is struggling with the emotional effects of fertility issues.
60,A person is dealing with the emotional fallout of a break-up.
61,A person is feeling insecure in their friendships and relationships with others.
62,A person is struggling to deal with the aftermath of a betrayal from a close friend or loved one.
63,A person is dealing with the effects of a physical altercation or violent crime.
64,A person is feeling isolated and disconnected from those around them.
65,A person is struggling to feel accepted in their community due to discrimination and prejudice.
66,A person is dealing with the emotional damage caused by constant criticism from a parent or family member.
67,A person is struggling to trust others due to previous experiences of betrayal.
68,A person is feeling overwhelmed by their responsibilities at school or work.
69,A person is feeling worried and anxious about the future.
70,A person is dealing with the emotional effects of a previous betrayal in a romantic relationship.
71,A person is feeling insecure and alone due to bullying or harassment.
72,A person is dealing with the emotional damage caused by a past abusive relationship.
73,A person is struggling to overcome past traumas and abuse.
74,A person is feeling frustrated and helpless due to chronic pain or illness.
75,A person is dealing with the emotional damage caused by a traumatic event.
76,A person is struggling to come to terms with their sexuality or gender identity.
77,A person is feeling pressured to conform to a specific lifestyle or societal norm.
78,A person is dealing with the emotional fallout of losing a beloved pet.
79,A person is struggling to deal with the effects of aging or illness on their body.
80,A person is feeling overwhelmed and anxious due to mounting debt and financial instability.
81,A person is dealing with the emotional damage caused by a previous relationship that ended poorly.
82,A person is struggling to adjust to a new job or living situation.
83,A person is feeling overwhelmed and unsupported in their caregiving responsibilities.
84,A person is dealing with the emotional fallout of a breakup or divorce that led to custody issues.
85,A person is struggling to deal with the emotional impact of a previous suicide attempt or self-harming behavior.
86,A person is feeling marginalized and excluded due to their social or economic status.
87,A person is dealing with the emotional effects of a past abusive or neglectful caregiver.
88,A person is struggling to cope with the emotional effects of chronic insomnia or other sleep disorders.
89,A person is feeling isolated and disconnected from their peers due to cultural differences or language barriers.
90,A person is dealing with the emotional damage caused by the sudden death of a loved one.
91,A person is struggling with anxiety or panic attacks related to a stressful work or home environment.
92,A person is dealing with the emotional fallout of being diagnosed with a serious illness or medical condition.
93,A person is feeling unsure and ungrounded due to a lack of stability in their living situation.
94,A person is dealing with the emotional damage caused by bullying or harassment in their workplace.
95,A person is struggling to cope with the emotional effects of a previous miscarriage or infertility.
96,A person is feeling overwhelmed and underappreciated in their caregiving duties for an elderly or disabled loved one.
97,A person is dealing with the emotional fallout of estrangement or rifts in family relationships.
98,A person is struggling to overcome the emotional effects of a past abusive or traumatic relationship.
99,A person is feeling disenfranchised and powerless in their community or work environment.
100,A person is dealing with the emotional effects of navigating life after recovering from addiction or substance abuse issues.
