index,response
1,"A party where people can mix, dance, and chat."
2,A lecture where people can ask questions and discuss ideas.
3,A workshop where people can collaborate on a project.
4,A networking event where people can make professional connections.
5,A community volunteer event where people can work together to benefit the community.
6,A book club where people can discuss literature and exchange ideas.
7,A music festival where people can enjoy musical performances and meet fellow fans.
8,A sports game where fans can cheer and socialize with each other.
9,A coffee shop where people can meet and chat.
10,A cooking class where participants can learn and socialize with others.
11,A language exchange program where people can practice speaking a new language and meet others.
12,A church or religious gathering where people can worship and socialize with others.
13,A happy hour event where coworkers can socialize after work.
14,A yoga or fitness class where people can work out and socialize with others.
15,A museum or art gallery where people can view exhibits and discuss their interpretations.
16,A travel group where people can explore new destinations together.
17,A gaming night where friends can play board games and socialize.
18,A baby shower where guests can socialize and celebrate the upcoming arrival of a baby.
19,A speed dating event where people can meet potential romantic partners.
20,A political rally or protest where people can voice their opinions and socialize with others who share their views.
21,A wedding where guests can socialize and celebrate the couple's love.
22,A book signing event where readers can meet and interact with their favorite authors.
23,"A backyard barbecue where friends and family can gather, socialize, and enjoy food and drinks."
24,A school dance where students can socialize and dance with each other.
25,A support group where people can discuss their struggles and offer each other help and encouragement.
26,A charity event where people can donate to a worthy cause and socialize with other supporters.
27,A trivia night where friends can test their knowledge and socialize with others.
28,A debate club where people can discuss and debate controversial issues.
29,A music class where participants can learn and socialize with others who share their love of music.
30,A retirement party where colleagues can socialize and celebrate the retiree's career.
31,A wine and cheese tasting event where guests can sample different wines and cheeses and socialize with each other.
32,A pet adoption event where potential adopters can meet and socialize with adoptable pets and other animal lovers.
33,"A community festival where people can enjoy food, music, and entertainment and socialize with their neighbors."
34,A charity walk or run where participants can support a cause and socialize with other participants.
35,A theater performance where audience members can discuss the play and socialize with each other.
36,A coffee break at work where coworkers can socialize and take a break from work.
37,"A street fair where people can enjoy food, music, and shopping and socialize with other attendees."
38,A game night at home where friends can play video games or board games and socialize.
39,A family reunion where relatives can socialize and catch up with each other.
40,A meetup group where people can gather and socialize around a shared interest or hobby.
41,A concert where people can enjoy live music and socialize with fellow music lovers.
42,A singles mixer where people can meet and socialize with other singles.
43,A meet and greet event where fans can meet their favorite celebrities and socialize with other fans.
44,A dance class where participants can learn to dance and socialize with other dancers.
45,A comedy club where people can laugh and socialize with other attendees.
46,A picnic where friends or family can enjoy food and socialize in a park or other outdoor space.
47,A trade show where people can network with other professionals in their industry.
48,A family game night where family members can play board games or card games and socialize.
49,A talent show where performers can entertain and socialize with attendees.
50,A charity auction where people can bid on items and socialize with other supporters of the charity.
51,A craft fair where people can enjoy shopping and socialize with other attendees.
52,A farmers market where people can buy fresh produce and socialize with local farmers and vendors.
53,A painting class where participants can learn to paint and socialize with other artists.
54,A community cleanup event where people can work together to clean up a local park or street and socialize with other volunteers.
55,A bike ride or hiking event where people can enjoy outdoor activities and socialize with other outdoor enthusiasts.
56,A cooking competition where participants can show off their culinary skills and socialize with other competitors.
57,A job fair where job seekers can network with potential employers and socialize with other job seekers.
58,A science fair where students can showcase their science projects and socialize with other science enthusiasts.
59,A poetry reading where poets can share their work and socialize with other poets.
60,A fashion show where attendees can enjoy fashion and socialize with other fashion enthusiasts.
61,A party where people can play games and socialize with other party-goers.
62,A debate event where people can discuss and debate current events and socialize with other attendees.
63,A photography class where participants can learn about photography and socialize with other photographers.
64,A comedy show where people can laugh and socialize with other attendees.
65,A meditation or yoga retreat where participants can relax and socialize with other like-minded individuals.
66,A karaoke night where people can sing and socialize with other karaoke enthusiasts.
67,A ski or snowboarding trip where people can enjoy winter sports and socialize with other participants.
68,A writing group where people can share their writing and socialize with other writers.
69,A film festival where attendees can enjoy movies and socialize with other film enthusiasts.
70,A cooking party where guests can cook and socialize with other guests.
71,A food and wine pairing event where attendees can sample different wines and foods and socialize.
72,A dance party where people can dance and socialize with other attendees.
73,A golf tournament where participants can play golf and socialize with other golf enthusiasts.
74,A gardening event where people can learn about gardening and socialize with other gardeners.
75,A bike race where participants can race and socialize with other participants.
76,A theatre production where attendees can enjoy the performance and socialize with other attendees.
77,A poetry slam where poets can compete and socialize with other poets.
78,A game tournament where participants can compete and socialize with other gamers.
79,A boat party where people can enjoy boating and socialize with other passengers.
80,A charity gala where attendees can donate to a worthy cause and socialize with other supporters.
81,A dance competition where participants can dance and socialize with other competitors.
82,A food festival where attendees can enjoy a variety of foods and socialize with other food lovers.
83,A plant sale where people can buy plants and socialize with other gardeners.
84,A charity auction where people can bid on items and socialize with other supporters of the charity.
85,A board game tournament where participants can compete and socialize with other gamers.
86,A charity walk or run where participants can support a cause and socialize with other participants.
87,A wine tasting event where guests can sample different wines and socialize with other attendees.
88,A trivia night where friends can test their knowledge and socialize with others.
89,A cooking class where participants can learn and socialize with others who share their interest in cooking.
90,A pet adoption event where potential adopters can meet and socialize with adoptable pets and other animal lovers.
91,"A community festival where people can enjoy food, music, and entertainment and socialize with their neighbors."
92,A charity event where people can donate to a worthy cause and socialize with other supporters.
93,A theater performance where audience members can discuss the play and socialize with each other.
94,A coffee break at work where coworkers can socialize and take a break from work.
95,"A street fair where people can enjoy food, music, and shopping and socialize with other attendees."
96,A game night at home where friends can play video games or board games and socialize.
97,A family reunion where relatives can socialize and catch up with each other.
98,A meetup group where people can gather and socialize around a shared interest or hobby.
99,A concert where people can enjoy live music and socialize with fellow music lovers.
100,A singles mixer where people can meet and socialize with other singles.
