index,response
1,Receiving a surprise visit from a loved one.
2,Relaxing on a sunny beach with a good book.
3,Winning a prize or award for your hard work.
4,Enjoying a delicious meal with family and friends.
5,Completing a difficult challenge or task.
6,Watching a beautiful sunset or sunrise.
7,Laughing and joking around with good friends.
8,Accomplishing a long-term goal or dream.
9,Receiving compliments or praise for your efforts.
10,Helping someone in need and making a positive impact.
11,Spending quality time with loved ones.
12,Going on a fun and exciting adventure or trip.
13,Making new friends and connections.
14,Listening to your favourite music or artist.
15,Experiencing a moment of pure joy or bliss.
16,Getting a promotion or new job.
17,Having a successful performance or show.
18,Seeing a loved one after a long time apart.
19,Being surrounded by natural beauty and serenity.
20,Learning a new skill or hobby.
21,Being recognized for your talents and contributions.
22,Discovering something new and fascinating.
23,Feeling appreciated by others.
24,Overcoming a difficult challenge or obstacle.
25,Receiving unexpected kindness or generosity.
26,Witnessing a miracle or amazing feat.
27,Celebrating holidays and special occasions.
28,Feeling proud of yourself for accomplishing something.
29,Finding true love and a soul mate.
30,Putting a smile on someone else's face.
31,Participating in a fun and lively community event.
32,Creating something beautiful or meaningful.
33,Relaxing in a warm and cozy environment.
34,Expressing your creativity and artwork.
35,Embracing your unique qualities and personality.
36,Spending time in the great outdoors.
37,Feeling a sense of accomplishment after working hard.
38,Watching a fun and entertaining movie or show.
39,Hugging a loved one and feeling their warmth.
40,Exploring a new culture or destination.
41,Being praised or recognized for your achievements.
42,Experiencing personal growth and development.
43,Overcoming a fear or phobia.
44,Receiving support and encouragement from others.
45,Feeling physically healthy and full of energy.
46,Discovering a new passion or interest.
47,Unplugging and disconnecting from technology for a while.
48,Spending time with cuddly and adorable animals.
49,Feeling inspired and motivated towards your goals.
50,Rediscovering an old hobby or interest.
51,Connecting with others through meaningful conversations.
52,Enjoying a refreshing and invigorating workout or exercise.
53,Being creative and crafty with a DIY project.
54,Having a romantic and intimate evening.
55,Making a positive impact on your community or society.
56,Sharing a meal and conversation with a new friend.
57,Being in the presence of someone you admire or respect.
58,Being involved in a high-energy and exciting event.
59,Feeling the rush of adrenaline or excitement.
60,Discovering a new and exciting adventure.
61,Feeling loved and appreciated by others.
62,Finding inner peace and tranquillity.
63,Connecting with your spirituality or faith.
64,Watching a beautiful and dazzling fireworks display.
65,Having a comforting conversation with a loved one.
66,Enjoying a relaxing and therapeutic massage or spa treatment.
67,Making new memories with loved ones.
68,Feeling a sense of accomplishment after a long day.
69,Taking in the beauty of nature and the environment.
70,Learning new things and expanding your knowledge.
71,Supporting a loved one through a difficult time.
72,Being a part of a happy and loving family.
73,Celebrating milestones and important achievements.
74,Being welcomed into a warm and welcoming community.
75,Feeling connected and bonded to others.
76,Being spontaneously surprised by something wonderful.
77,Sharing your passions and hobbies with others.
78,Having a meaningful and heartfelt conversation with someone.
79,"Feeling safe, secure, and protected."
80,Being surrounded by beauty and art.
81,Knowing that you have made a difference in someone's life.
82,Being appreciated for who you are and what you do.
83,Enjoying a delicious and healthy meal.
84,Experiencing the thrill of a lifetime.
85,Feeling content and satisfied with your life.
86,Forging new connections and relationships with others.
87,Embracing your inner child and playful side.
88,Enjoying a warm and cozy night in.
89,Taking a leisurely stroll through a beautiful neighbourhood.
90,Finding peace and solace in a place of worship.
91,Having a kind and supportive partner by your side.
92,Being a part of something bigger than yourself.
93,Feeling accomplished and successful in your career.
94,Being showered with love on your special day.
95,Celebrating your achievements with those you care about.
96,Spending quality time with your furry animal companion.
97,Feeling the rush of excitement to travel to a new and exotic location.
98,Having a fun and lighthearted conversation with someone.
99,Connecting with your creative side through art or music.
100,"Feeling loved, valued, and respected by those around you."
