index,response
1,A busy city street intersection during rush hour.
2,A chaotic kitchen during meal preparation.
3,A crowded subway car during commuting hours.
4,A loud and crowded concert venue during a performance.
5,A bustling train station during peak travel times.
6,A factory floor during production hours.
7,A busy emergency room during a crisis.
8,A shopping mall during holiday season sales.
9,A construction site during multiple projects.
10,A sports stadium during a game.
11,A busy coffee shop during morning rush.
12,A hectic department store on Black Friday.
13,A film set with multiple scenes being filmed simultaneously.
14,A large family gathering with multiple conversations happening at once.
15,A busy airport during peak travel times.
16,A bustling business office during a workday.
17,A crowded festival or fairground with many events happening.
18,A chaotic hospital during a pandemic.
19,A busy shipping port with multiple ships and cargo being loaded.
20,A busy gym with many people working out simultaneously.
21,A theme park with multiple attractions running at once.
22,A busy library during finals week.
23,A crowded amusement arcade with many games being played at once.
24,A buzzing newsroom during a breaking story.
25,A multiple-lane toll booth during a holiday weekend.
26,A busy beach with many activities taking place at the same time.
27,A crowded restaurant during meal service.
28,A buzzing nightclub with multiple DJs playing music simultaneously.
29,A busy courtroom during a high-profile trial.
30,A crowded museum or attraction during open hours.
31,An assembly line during manufacturing.
32,A busy pet store during adoption day.
33,A crowded public park during a festival or event.
34,A crowded bus or train during the commute.
35,A busy daycare center during playtime.
36,A farm with multiple animals and crops being tended.
37,A busy call center with multiple agents handling calls simultaneously.
38,A conference with multiple speakers and sessions happening simultaneously.
39,A bustling hair salon during peak hours.
40,A busy university campus during class breaks.
41,A packed nightclub during a surprise performance.
42,A busy car wash with multiple cars being cleaned at once.
43,A crowded ski resort with many slopes open.
44,A busy theme park during Halloween horror nights.
45,A crowded church during a holiday service.
46,A bustling convention center during a trade show.
47,A busy bowling alley with multiple lanes in use.
48,A bustling subway station during rush hour.
49,A crowded grocery store during a holiday.
50,A busy movie theater during opening weekend.
51,A crowded hospital during a natural disaster.
52,A busy bakery during peak baking hours.
53,A bustling hotel lobby during check-in time.
54,A crowded car dealership during a sale.
55,A busy IT office during multiple projects.
56,A buzzing casino with multiple games in play.
57,A crowded gym during multiple fitness classes.
58,A packed street festival with multiple stages of performers.
59,A chaotic police station during a crisis.
60,A busy hair salon during wedding season.
61,A crowded aquarium during feeding time.
62,A busy campground during a holiday weekend.
63,A bustling shopping district during the holiday season.
64,A crowded gas station during peak travel times.
65,A busy florist during a holiday.
66,A crowded concert venue during intermission.
67,A packed airport terminal during a weather delay.
68,A busy veterinary clinic with multiple animals being treated.
69,A crowded theme park during a parade.
70,A buzzing nightclub during a major sporting event.
71,A bustling grocery store during meal preparation hours.
72,A busy water park with multiple rides in operation.
73,A crowded hotel conference room during a business meeting.
74,A buzzing nightclub during a popular DJ set.
75,A crowded college library during finals week.
76,A busy shipping warehouse during holiday preparation.
77,A bustling airport security checkpoint during peak travel times.
78,A crowded riverfront during a city festival.
79,A busy construction site during multiple projects.
80,A packed wedding venue during a reception.
81,A bustling sports arena during multiple games or events.
82,A busy coffee shop during after-work hours.
83,A crowded amusement park during a fireworks show.
84,A buzzing nightclub during karaoke night.
85,A crowded wedding reception during a bouquet toss.
86,A busy food court during peak holiday shopping hours.
87,A crowded fairway at a busy golf course.
88,A busy shipping port during holiday shipping season.
89,A crowded petting zoo during feeding times.
90,A buzzing nightclub during a trivia night.
91,A crowded school cafeteria during lunchtime.
92,A crowded car wash during peak car-cleaning season.
93,A bustling library during book return week.
94,A busy university gym during peak hours.
95,A packed conference room during a press conference.
96,A busy kitchen during cooking classes.
97,A crowded skatepark during a competition.
98,A bustling airport baggage claim area during peak travel times.
99,A crowded retirement home during entertainment hours.
100,A busy bowling alley with multiple birthday parties.
