index,response
1,Paying rent or mortgage on time to avoid late fees or eviction.
2,"Budgeting for daily expenses such as groceries, transportation, and utilities."
3,Saving money for retirement to ensure financial stability in the future.
4,Paying off student loans or credit card debt to avoid high interest rates.
5,"Paying for medical expenses, including health insurance premiums and deductibles."
6,Investing in stocks or mutual funds to increase wealth and earn passive income.
7,"Paying for a child's education, including tuition, textbooks, and room and board."
8,Buying a car or other mode of transportation for commuting or travel.
9,"Paying for home repairs or renovations, including the cost of materials and labor."
10,Providing financial support for aging parents or relatives in assisted living facilities.
11,Funding a startup business or idea to achieve financial independence.
12,Paying for legal fees or settlements in the case of a lawsuit or dispute.
13,Supporting charitable causes or making donations to non-profit organizations.
14,Saving for a down payment on a house or property.
15,Paying for home or auto insurance premiums to protect against financial loss.
16,"Funding a hobby or personal interest, such as travel or collecting."
17,"Paying for a wedding or other important celebration, including catering and entertainment."
18,Buying gifts for family and friends on special occasions.
19,"Financing a major purchase such as a boat, RV, or vacation home."
20,"Paying for taxes and related expenses, including hiring a tax professional."
21,Paying for child care or nanny services to balance work and family responsibilities.
22,Paying for a gym membership or personal trainer for health and wellness.
23,Saving for emergencies such as unexpected medical expenses or job loss.
24,Paying for a burial or funeral expenses.
25,Buying life insurance to provide for loved ones in the event of the policyholder's death.
26,Financing a higher education degree or certification program to advance in a career.
27,Paying for prescription medication or medical devices not covered by insurance.
28,Renting or leasing office space for a small business or entrepreneurial venture.
29,Paying for a pet's veterinary care and related expenses.
30,Providing financial assistance to friends or family members in need.
31,"Paying for home security systems, including installation and monitoring services."
32,"Financing a vacation or trip abroad, including airfare and accommodations."
33,Paying for legal immigration or citizenship processes.
34,Funding a scholarship or fellowship for academic or professional development.
35,Providing financial support for a religious organization or community.
36,"Investing in gold, silver, or other precious metals as a diversification strategy."
37,Paying for a personal assistant or concierge services for convenience and efficiency.
38,"Paying for aromatherapy, massage, or other complementary therapies for wellness or relaxation."
39,Providing financial assistance for a spouse or partner's business venture or career change.
40,Buying or leasing equipment or machinery for a small business.
41,Paying for addiction treatment or counseling services.
42,Providing financial support for environmental conservation efforts.
43,Saving for a child's wedding or other significant life event.
44,Buying a collectible or rare item as an investment.
45,Paying for private school or tutoring services for a child's education.
46,Financing a creative project such as a film or art exhibit.
47,Paying for a yearly subscription to a personal finance or investment publication.
48,"Buying a luxury item such as jewelry, watches, or designer clothing."
49,Paying for membership in an exclusive country club or similar organization.
50,Financing a home-based business or home office renovation.
51,"Paying for home cleaning, lawn care, or other household maintenance services."
52,Investing in real estate to generate rental income or capital appreciation.
53,Paying for a piano or other musical instrument and lessons for personal enrichment.
54,Providing financial support for a political campaign or cause.
55,Buying or leasing a commercial property for business purposes.
56,Paying for an extended warranty or service contract for major appliances or electronics.
57,Financing a solar panel or other energy-efficient upgrades for a home or business.
58,Paying for membership in a health or fitness club for personal wellness.
59,Providing financial support for a humanitarian relief effort or disaster relief.
60,Saving for a child's future college education expenses.
61,Buying or leasing a recreational vehicle for travel and adventure.
62,Paying for home staging or interior design services to sell a property.
63,Investing in foreign currencies or emerging markets for diversification.
64,"Paying for a private chef, meal delivery, or catering services for convenience and luxury."
65,Financing a farming or agricultural operation for sustainable food production.
66,"Paying for a private investigator, security detail, or bodyguard for safety."
67,Providing financial support for a health care or medical research organization.
68,Saving for a child's eventual home or car expenses.
69,Buying or leasing a private jet or helicopter for personal or business travel.
70,Paying for a cosmetic procedure or plastic surgery to improve appearance.
71,Financing a technology startup or app development.
72,Paying for mental health counseling or therapy services.
73,Providing financial support for a performing arts organization or theater.
74,Saving for a child's future wedding expenses.
75,Buying or leasing a luxury car or sports vehicle for personal enjoyment.
76,Paying for a private tutor or mentor for personal or professional development.
77,Financing a franchise or licensing agreement for a business opportunity.
78,Paying for cosmetic dental services such as veneers or braces.
79,Providing financial support for a community or social justice cause.
80,Saving for a child's future travel expenses or study abroad program.
81,"Financing a luxury yacht, cruise ship, or similar vessel for personal or business entertainment."
82,Paying for home automation or smart home technology for convenience and security.
83,Investing in startups or companies committed to sustainable or ethical business practices.
84,"Paying for a career coach, mentor, or executive education program for professional development."
85,Financing a private island for personal retreat or investment.
86,Paying for a private driver or transportation service for convenience and efficiency.
87,Providing financial support for a cultural or arts festival or event.
88,Saving for a child's eventual business or entrepreneurial venture.
89,Buying or leasing a private island or vacation property for personal use or rental income.
90,"Financing a private jet, helicopter, or airplane rental or charter for personal or business travel."
91,"Paying for a personal shopper, stylist, or wardrobe consultant for fashion or image management."
92,Providing financial support for an animal welfare or conservation organization.
93,Saving for a child's eventual charitable or social impact endeavors.
94,"Financing a private resort, vacation club, or timeshare for personal enjoyment or rental income."
95,Paying for a personal chef or meal delivery service focused on healthy or organic foods.
96,Providing financial support for a museum or historical preservation organization.
97,Saving for a child's college education or future career in the arts or entertainment industry.
98,Buying or leasing a private train or luxury railcar for personal or business travel.
99,"Financing a private art collection, antique collection, or other memorabilia for personal enjoyment or investment."
100,Paying for a private tour guide or travel itinerary planner for custom travel experiences.
