index,response
1,A salesperson uses aggressive tactics to persuade a customer to buy a product.
2,A politician resorts to aggressive tactics to win an argument.
3,A boss uses aggressive tactics to intimidate employees into working harder.
4,A student bullies a classmate to get the answers to a test.
5,A gambler threatens violence to collect a debt from a fellow gambler.
6,A parent uses aggressive tactics to control their child's behavior.
7,A coach yells and berates their players to motivate them.
8,An investor threatens their partner to make them invest more money.
9,A customer throws a tantrum to get better service in a restaurant.
10,A partner uses aggressive tactics to control their significant other in a relationship.
11,An entrepreneur uses dirty tricks to drive a competitor out of business.
12,A manager uses threats to prevent an employee from quitting.
13,A landlord uses aggressive tactics to intimidate a tenant into paying rent.
14,A hacker uses aggressive tactics to access sensitive information.
15,A teammate resorts to aggression to ensure they are the team captain.
16,A parent uses physical force to make their child eat.
17,A coworker uses intimidation to convince others to take on their workload.
18,A coach encourages their team to use aggressive tactics to win a game.
19,A teacher uses verbal abuse to control their students.
20,A driver uses aggressive tactics on the road to get ahead of other cars.
21,A boss uses aggressive tactics to force an employee to work overtime.
22,A customer uses aggressive behavior to return an item without a receipt.
23,A landlord uses aggressive tactics to keep a tenant from having guests over.
24,A salesperson threatens to reveal personal information to make a sale.
25,A team leader uses aggressive tactics to push their team to meet a deadline.
26,A spouse uses aggressive tactics to control the finances in a relationship.
27,A parent screams and hits their child for misbehaving.
28,A coworker intimidates others to make sure they are always in charge.
29,A politician uses dirty tricks to win an election.
30,A coach uses aggressive tactics to push their team to win a championship.
31,A student uses aggressive tactics to get a professor to change their grade.
32,A customer yells and curses at a retail employee for poor service.
33,A boss threatens an employee to keep quiet about illegal activities.
34,A tenant uses intimidation to prevent a landlord from inspecting their unit.
35,A manager uses aggressive tactics to force an employee to work through an illness.
36,An abusive partner uses aggression to control and manipulate their significant other.
37,A business owner uses aggressive tactics to force suppliers to lower their prices.
38,A bully uses aggressive tactics to get their way and control others.
39,A coach encourages their team to use aggressive tactics to injure opponents.
40,An investor resorts to aggression to force a business partner to sign a contract.
41,A parent uses physical violence to control their child's behavior.
42,A coworker uses aggressive tactics to take credit for someone else's work.
43,A landlord uses aggressive tactics to evict a tenant without cause.
44,A teacher uses intimidation to prevent students from questioning their authority.
45,A driver uses aggressive tactics to cut off another car on the road.
46,A boss uses aggressive tactics to prevent employees from forming a union.
47,A customer uses aggressive behavior to demand a refund for a defective product.
48,A landlord uses aggressive tactics to prevent a tenant from having a pet.
49,A salesperson uses aggressive tactics to pressure a customer into signing a contract.
50,A team leader uses aggressive tactics to get their team to work unpaid overtime.
51,A spouse uses aggressive tactics to prevent their significant other from leaving.
52,A parent uses withholding behavior to control their child's behavior.
53,A coworker uses aggressive tactics to sabotage a colleague's career.
54,A politician uses smear campaigns to win more votes.
55,An athlete uses aggressive tactics to injure opponents during a game.
56,A student uses aggressive tactics to force a professor to raise their grade.
57,A customer uses aggressive behavior to demand a discount on a purchase.
58,A boss uses aggressive tactics to ensure their employees don't leave for a competitor.
59,A tenant uses intimidation to prevent a landlord from making repairs.
60,A teacher uses aggressive tactics to force students to do things their way.
61,A driver uses aggressive tactics to honk at other drivers who don't move fast enough.
62,A boss uses aggressive tactics to fire employees who refuse to work unpaid overtime.
63,A partner uses aggressive behavior to prevent their significant other from having friends.
64,A parent uses aggressive tactics to force their child to participate in activities.
65,A coworker uses aggressive tactics to spread rumors about a colleague.
66,A landlord uses aggressive tactics to prevent a tenant from subletting their apartment.
67,A parent uses fear tactics to control their child's behavior.
68,A politician uses bribery to win votes.
69,An athlete uses aggression to intimidate opponents during a game.
70,A student uses aggressive tactics to blackmail a professor.
71,A customer uses aggressive behavior to demand special treatment.
72,A boss uses aggressive tactics to force employees to work long hours without breaks.
73,A tenant uses aggression to prevent a landlord from entering their apartment.
74,A teacher uses aggressive tactics to punish students who don't follow their rules.
75,A driver uses aggressive tactics to cut off other cars on the road.
76,A boss uses aggressive tactics to prevent employees from getting promoted.
77,An abusive partner uses aggression to control their significant other's appearance.
78,A parent uses guilt trips to control their child's behavior.
79,A coworker uses aggressive tactics to bully a colleague into doing things their way.
80,A landlord uses aggressive tactics to prevent a tenant from using a shared space.
81,A politician uses blackmail to win an election.
82,A student uses aggressive tactics to cheat on a test.
83,A customer uses aggressive behavior to make a scene in a restaurant.
84,A boss uses aggressive tactics to force employees to work through their breaks.
85,A tenant uses intimidation to force a landlord to lower their rent.
86,A teacher uses aggressive tactics to punish students who speak out of turn.
87,A driver uses aggressive tactics to tailgate other cars on the road.
88,A boss uses aggressive tactics to prevent employees from leaving for a better job.
89,A parent uses aggressive tactics to force their child to do things they don't want to do.
90,A coworker uses aggression to prevent a colleague's ideas from being implemented.
91,A landlord uses aggressive tactics to force a tenant to move out before their lease is up.
92,A partner uses aggressive tactics to prevent their significant other from leaving the house.
93,A politician uses violent protests to achieve their goals.
94,An athlete uses aggression to provoke opponents during a game.
95,A student uses aggressive tactics to steal another student's project.
96,A customer uses aggressive behavior to demand to speak to a manager.
97,A boss uses aggressive tactics to fire employees who take sick days.
98,A tenant uses aggression to prevent a landlord from entering their apartment without notice.
99,A teacher uses aggressive tactics to belittle students who make mistakes.
100,A driver uses aggressive tactics to honk at other cars for minor infractions.
